mysql> show database;
ERROR 1064 (42000): You have an error in your SQL syntax; check the manual that corresponds to your MySQL server version for the right syntax to use near 'database' at line 1
mysql> show databases;
+----------------------------+
| Database                   |
+----------------------------+
| employeepayrol_service_new |
| information_schema         |
| mysql                      |
| payroll_service_new        |
| performance_schema         |
| sys                        |
+----------------------------+
6 rows in set (0.01 sec)

mysql> use payroll_service_new;
Database changed
mysql> create table employee_payroll_new(
    -> id int unsigned not null auto_increment,
    -> name varchar(30) not null,
    -> salary double not null,
    -> start_date date not null,
    -> primary key(id));
Query OK, 0 rows affected (1.74 sec)

mysql> desc employee_payroll_new;
+------------+--------------+------+-----+---------+----------------+
| Field      | Type         | Null | Key | Default | Extra          |
+------------+--------------+------+-----+---------+----------------+
| id         | int unsigned | NO   | PRI | NULL    | auto_increment |
| name       | varchar(30)  | NO   |     | NULL    |                |
| salary     | double       | NO   |     | NULL    |                |
| start_date | date         | NO   |     | NULL    |                |
+------------+--------------+------+-----+---------+----------------+
4 rows in set (0.22 sec)

mysql> insert into employee_payroll_new(name,salary,start_date)values('Bill',1000000.00,'2010-10-30'),('Tersia',2000000.00,'2019-11-13'),('Charlie',300000.00,'2020-05-21');
Query OK, 3 rows affected (0.25 sec)
Records: 3  Duplicates: 0  Warnings: 0

mysql>  select * from employee_payroll_new;
+----+---------+---------+------------+
| id | name    | salary  | start_date |
+----+---------+---------+------------+
|  1 | Bill    | 1000000 | 2010-10-30 |
|  2 | Tersia  | 2000000 | 2019-11-13 |
|  3 | Charlie |  300000 | 2020-05-21 |
+----+---------+---------+------------+
3 rows in set (0.00 sec)

mysql>  select salary from employee_payroll_new where name = 'Bill';
+---------+
| salary  |
+---------+
| 1000000 |
+---------+
1 row in set (0.04 sec)

mysql> select start_date from employee_payroll_new where start_date between cast('2018-01-01' as date) and date(now());
+------------+
| start_date |
+------------+
| 2019-11-13 |
| 2020-05-21 |
+------------+
2 rows in set (0.08 sec)

mysql> alter table employee_payroll_new add gender varchar(1) after name;
Query OK, 0 rows affected (0.21 sec)
Records: 0  Duplicates: 0  Warnings: 0

mysql> select * from employee_payroll_new;
+----+---------+--------+---------+------------+
| id | name    | gender | salary  | start_date |
+----+---------+--------+---------+------------+
|  1 | Bill    | NULL   | 1000000 | 2010-10-30 |
|  2 | Tersia  | NULL   | 2000000 | 2019-11-13 |
|  3 | Charlie | NULL   |  300000 | 2020-05-21 |
+----+---------+--------+---------+------------+
3 rows in set (0.00 sec)

mysql> update employee_payroll_new set gender = 'M'  where name = 'Bill' or  name = 'Charlie';
Query OK, 2 rows affected (0.09 sec)
Rows matched: 2  Changed: 2  Warnings: 0

mysql>  update employee_payroll_new set gender = 'F'  where name = 'Tersia';
Query OK, 1 row affected (0.05 sec)
Rows matched: 1  Changed: 1  Warnings: 0

mysql> select * from employee_payroll_new;
+----+---------+--------+---------+------------+
| id | name    | gender | salary  | start_date |
+----+---------+--------+---------+------------+
|  1 | Bill    | M      | 1000000 | 2010-10-30 |
|  2 | Tersia  | F      | 2000000 | 2019-11-13 |
|  3 | Charlie | M      |  300000 | 2020-05-21 |
+----+---------+--------+---------+------------+
3 rows in set (0.00 sec)

mysql> select sum(salary) from employee_payroll_new where gender = 'M' group by gender;]
+-------------+
| sum(salary) |
+-------------+
|     1300000 |
+-------------+
1 row in set (0.10 sec)

    -> select avg(salary) from employee_payroll_new where gender = 'M' group by gender;
ERROR 1064 (42000): You have an error in your SQL syntax; check the manual that corresponds to your MySQL server version for the right syntax to use near ']
select avg(salary) from employee_payroll_new where gender = 'M' group by gende' at line 1
mysql> select avg(salary) from employee_payroll_new where gender = 'M' group by gender;
+-------------+
| avg(salary) |
+-------------+
|      650000 |
+-------------+
1 row in set (0.00 sec)

mysql>  select min(salary) from employee_payroll_new where gender = 'M' group by gender;
+-------------+
| min(salary) |
+-------------+
|      300000 |
+-------------+
1 row in set (0.05 sec)

mysql> select max(salary) from employee_payroll_new where gender = 'F' group by gender;
+-------------+
| max(salary) |
+-------------+
|     2000000 |
+-------------+
1 row in set (0.00 sec)

mysql>  select count(salary) from employee_payroll_new where gender = 'M' group by gender;
+---------------+
| count(salary) |
+---------------+
|             2 |
+---------------+
1 row in set (0.00 sec)

mysql> select count(salary) from employee_payroll_new where gender = 'F' group by gender;
+---------------+
| count(salary) |
+---------------+
|             1 |
+---------------+
1 row in set (0.00 sec)

mysql>  alter table employee_payroll_new add phone_number varchar(250) after name;
Query OK, 0 rows affected (0.09 sec)
Records: 0  Duplicates: 0  Warnings: 0

mysql> alter table employee_payroll_new add address varchar(250) after phone_number;
Query OK, 0 rows affected (0.09 sec)
Records: 0  Duplicates: 0  Warnings: 0

mysql>  alter table employee_payroll_new add department varchar(150) not null after address;
Query OK, 0 rows affected (0.10 sec)
Records: 0  Duplicates: 0  Warnings: 0

mysql> select * from employee_payroll_new;
+----+---------+--------------+---------+------------+--------+---------+------------+
| id | name    | phone_number | address | department | gender | salary  | start_date |
+----+---------+--------------+---------+------------+--------+---------+------------+
|  1 | Bill    | NULL         | NULL    |            | M      | 1000000 | 2010-10-30 |
|  2 | Tersia  | NULL         | NULL    |            | F      | 2000000 | 2019-11-13 |
|  3 | Charlie | NULL         | NULL    |            | M      |  300000 | 2020-05-21 |
+----+---------+--------------+---------+------------+--------+---------+------------+
3 rows in set (0.00 sec)

mysql>  alter table employee_payroll_new alter address set default 'TBD';
Query OK, 0 rows affected (0.08 sec)
Records: 0  Duplicates: 0  Warnings: 0

mysql> select * from employee_payroll_new;
+----+---------+--------------+---------+------------+--------+---------+------------+
| id | name    | phone_number | address | department | gender | salary  | start_date |
+----+---------+--------------+---------+------------+--------+---------+------------+
|  1 | Bill    | NULL         | NULL    |            | M      | 1000000 | 2010-10-30 |
|  2 | Tersia  | NULL         | NULL    |            | F      | 2000000 | 2019-11-13 |
|  3 | Charlie | NULL         | NULL    |            | M      |  300000 | 2020-05-21 |
+----+---------+--------------+---------+------------+--------+---------+------------+
3 rows in set (0.00 sec)

mysql> desc employee_payroll_new;
+--------------+--------------+------+-----+---------+----------------+
| Field        | Type         | Null | Key | Default | Extra          |
+--------------+--------------+------+-----+---------+----------------+
| id           | int unsigned | NO   | PRI | NULL    | auto_increment |
| name         | varchar(30)  | NO   |     | NULL    |                |
| phone_number | varchar(250) | YES  |     | NULL    |                |
| address      | varchar(250) | YES  |     | TBD     |                |
| department   | varchar(150) | NO   |     | NULL    |                |
| gender       | varchar(1)   | YES  |     | NULL    |                |
| salary       | double       | NO   |     | NULL    |                |
| start_date   | date         | NO   |     | NULL    |                |
+--------------+--------------+------+-----+---------+----------------+
8 rows in set (0.01 sec)

mysql> lter table employee_payroll_new rename column salary to basic_pay;
ERROR 1064 (42000): You have an error in your SQL syntax; check the manual that corresponds to your MySQL server version for the right syntax to use near 'lter table employee_payroll_new rename column salary to basic_pay' at line 1
mysql> alter table employee_payroll_new rename column salary to basic_pay;
Query OK, 0 rows affected (0.11 sec)
Records: 0  Duplicates: 0  Warnings: 0

mysql>  select * from employee_payroll_new;
+----+---------+--------------+---------+------------+--------+-----------+------------+
| id | name    | phone_number | address | department | gender | basic_pay | start_date |
+----+---------+--------------+---------+------------+--------+-----------+------------+
|  1 | Bill    | NULL         | NULL    |            | M      |   1000000 | 2010-10-30 |
|  2 | Tersia  | NULL         | NULL    |            | F      |   2000000 | 2019-11-13 |
|  3 | Charlie | NULL         | NULL    |            | M      |    300000 | 2020-05-21 |
+----+---------+--------------+---------+------------+--------+-----------+------------+
3 rows in set (0.00 sec)

mysql> alter table employee_payroll_new add deductions double not null after basic_pay;
Query OK, 0 rows affected (0.14 sec)
Records: 0  Duplicates: 0  Warnings: 0

mysql> alter table employee_payroll_new add taxable_pay double not null after deductions;
Query OK, 0 rows affected (0.22 sec)
Records: 0  Duplicates: 0  Warnings: 0

mysql> alter table employee_payroll_new add tax double not null after taxable_pay;
Query OK, 0 rows affected (0.09 sec)
Records: 0  Duplicates: 0  Warnings: 0

mysql>  alter table employee_payroll_new add net_pay double not null after tax;
Query OK, 0 rows affected (0.28 sec)
Records: 0  Duplicates: 0  Warnings: 0

mysql>  select * from employee_payroll_new;
+----+---------+--------------+---------+------------+--------+-----------+------------+-------------+-----+---------+------------+
| id | name    | phone_number | address | department | gender | basic_pay | deductions | taxable_pay | tax | net_pay | start_date |
+----+---------+--------------+---------+------------+--------+-----------+------------+-------------+-----+---------+------------+
|  1 | Bill    | NULL         | NULL    |            | M      |   1000000 |          0 |           0 |   0 |       0 | 2010-10-30 |
|  2 | Tersia  | NULL         | NULL    |            | F      |   2000000 |          0 |           0 |   0 |       0 | 2019-11-13 |
|  3 | Charlie | NULL         | NULL    |            | M      |    300000 |          0 |           0 |   0 |       0 | 2020-05-21 |
+----+---------+--------------+---------+------------+--------+-----------+------------+-------------+-----+---------+------------+
3 rows in set (0.00 sec)

mysql> update employee_payroll_new set department = 'Sales' where name = 'Tersia'
    -> ;
Query OK, 1 row affected (0.04 sec)
Rows matched: 1  Changed: 1  Warnings: 0

mysql>  select * from employee_payroll_new
    -> ;
+----+---------+--------------+---------+------------+--------+-----------+------------+-------------+-----+---------+------------+
| id | name    | phone_number | address | department | gender | basic_pay | deductions | taxable_pay | tax | net_pay | start_date |
+----+---------+--------------+---------+------------+--------+-----------+------------+-------------+-----+---------+------------+
|  1 | Bill    | NULL         | NULL    |            | M      |   1000000 |          0 |           0 |   0 |       0 | 2010-10-30 |
|  2 | Tersia  | NULL         | NULL    | Sales      | F      |   2000000 |          0 |           0 |   0 |       0 | 2019-11-13 |
|  3 | Charlie | NULL         | NULL    |            | M      |    300000 |          0 |           0 |   0 |       0 | 2020-05-21 |
+----+---------+--------------+---------+------------+--------+-----------+------------+-------------+-----+---------+------------+
3 rows in set (0.00 sec)

mysql> insert into employee_payroll_new(name, department, gender, basic_pay, deductions, taxable_pay, tax, net_pay, start_date)values('Tersia', 'Marketing', 'F', '3000000', '1000000', '2000000', '500000', '1500000', '2018-01-03' )
    -> ;
Query OK, 1 row affected (0.07 sec)

mysql> select * from employee_payroll_new;
+----+---------+--------------+---------+------------+--------+-----------+------------+-------------+--------+---------+------------+
| id | name    | phone_number | address | department | gender | basic_pay | deductions | taxable_pay | tax    | net_pay | start_date |
+----+---------+--------------+---------+------------+--------+-----------+------------+-------------+--------+---------+------------+
|  1 | Bill    | NULL         | NULL    |            | M      |   1000000 |          0 |           0 |      0 |       0 | 2010-10-30 |
|  2 | Tersia  | NULL         | NULL    | Sales      | F      |   2000000 |          0 |           0 |      0 |       0 | 2019-11-13 |
|  3 | Charlie | NULL         | NULL    |            | M      |    300000 |          0 |           0 |      0 |       0 | 2020-05-21 |
|  4 | Tersia  | NULL         | TBD     | Marketing  | F      |   3000000 |    1000000 |     2000000 | 500000 | 1500000 | 2018-01-03 |
+----+---------+--------------+---------+------------+--------+-----------+------------+-------------+--------+---------+------------+
4 rows in set (0.00 sec)
